%------------------------------------------------------------------------------
File       : Prover9---1109a
Problem    : SYN726-1 : TPTP v5.3.0. Released v2.5.0.
Transform  : none
Format     : tptp:raw
Command    : run_prover9 %d %s

Computer   : art05.cs.miami.edu
Model      : i686 i686
CPU        : Intel(R) Pentium(R) 4 CPU 2.80GHz @ 2800MHz
Memory     : 2005MB
OS         : Linux 2.6.32.26-175.fc12.i686.PAE
CPULimit   : 300s
DateTime   : Thu Jun 14 20:13:22 EDT 2012

Result     : Unsatisfiable 0.59s
Output     : Refutation 0.59s
Verified   : 
Statistics : -

Comments   : 
%------------------------------------------------------------------------------
%----ERROR: Could not form TPTP format derivation
%------------------------------------------------------------------------------
%----ORIGINAL SYSTEM OUTPUT
============================== Prover9 ===============================
Prover9 (32) version 2009-11A, November 2009.
Process 6643 was started by tptp on art05.cs.miami.edu,
Thu Jun 14 20:13:23 2012
The command was "/home/graph/tptp/Systems/Prover9---1109a/prover9 -t 300 -f /tmp/Prover9_6589_art05.cs.miami.edu".
============================== end of head ===========================
============================== INPUT =================================
% Reading from file /tmp/Prover9_6589_art05.cs.miami.edu
set(prolog_style_variables).
set(auto2).
    % set(auto2) -> set(auto).
    % set(auto) -> set(auto_inference).
    % set(auto) -> set(auto_setup).
    % set(auto_setup) -> set(predicate_elim).
    % set(auto_setup) -> assign(eq_defs, unfold).
    % set(auto) -> set(auto_limits).
    % set(auto_limits) -> assign(max_weight, "100.000").
    % set(auto_limits) -> assign(sos_limit, 20000).
    % set(auto) -> set(auto_denials).
    % set(auto) -> set(auto_process).
    % set(auto2) -> assign(new_constants, 1).
    % set(auto2) -> assign(fold_denial_max, 3).
    % set(auto2) -> assign(max_weight, "200.000").
    % set(auto2) -> assign(max_hours, 1).
    % assign(max_hours, 1) -> assign(max_seconds, 3600).
    % set(auto2) -> assign(max_seconds, 0).
    % set(auto2) -> assign(max_minutes, 5).
    % assign(max_minutes, 5) -> assign(max_seconds, 300).
    % set(auto2) -> set(sort_initial_sos).
    % set(auto2) -> assign(sos_limit, -1).
    % set(auto2) -> assign(lrs_ticks, 3000).
    % set(auto2) -> assign(max_megs, 400).
    % set(auto2) -> assign(stats, some).
    % set(auto2) -> clear(echo_input).
    % set(auto2) -> set(quiet).
    % set(auto2) -> clear(print_initial_clauses).
    % set(auto2) -> clear(print_given).
assign(lrs_ticks,-1).
assign(sos_limit,10000).
assign(order,kbo).
set(lex_order_vars).
clear(print_given).
% formulas(sos).  % not echoed (6 formulas)
============================== end of input ==========================
% From the command line: assign(max_seconds, 300).
============================== PROCESS NON-CLAUSAL FORMULAS ==========
% Formulas that are not ordinary clauses:
============================== end of process non-clausal formulas ===
============================== PROCESS INITIAL CLAUSES ===============
============================== PREDICATE ELIMINATION =================
============================== end predicate elimination =============
Auto_denials:  (non-Horn, no changes).
Term ordering decisions:
Function symbol KB weights:  sk1=1. sk2=1. sk3=1. sk4=1.
============================== end of process initial clauses ========
============================== CLAUSES FOR SEARCH ====================
============================== end of clauses for search =============
============================== SEARCH ================================
% Starting search at 0.00 seconds.
============================== PROOF =================================
% Proof 1 at 0.01 (+ 0.00) seconds.
% Length of proof is 18.
% Level of proof is 7.
% Maximum clause weight is 9.000.
% Given clauses 21.
1 p(A,B) | q(A,B) # label(_11611) # label(_11615).  [assumption].
2 -p(sk1,sk2) # label(_11636) # label(_11640).  [assumption].
3 -q(sk3,sk4) # label(_11661) # label(_11665).  [assumption].
4 q(A,B) | -q(B,A) # label(_11580) # label(_11584).  [assumption].
5 p(A,B) | -p(A,C) | -p(C,B) # label(_11512) # label(_11516).  [assumption].
6 q(A,B) | -q(A,C) | -q(C,B) # label(_11549) # label(_11553).  [assumption].
7 q(sk1,sk2).  [resolve(2,a,1,a)].
8 -q(sk4,sk3).  [ur(4,a,3,a)].
9 p(A,B) | -p(C,B) | q(A,C).  [resolve(5,b,1,a)].
13 q(sk2,sk1).  [resolve(7,a,4,b)].
15 q(sk2,A) | -q(sk1,A).  [resolve(13,a,6,b)].
18 p(A,B) | q(A,C) | q(C,B).  [resolve(9,b,1,a)].
22 q(sk1,A) | q(A,sk2).  [resolve(18,a,2,a)].
23 q(A,sk2) | q(sk2,A).  [resolve(22,a,15,b)].
33 q(sk2,A).  [resolve(23,a,4,b),merge(b)].
35 q(A,sk2).  [resolve(23,b,4,b),merge(b)].
39 q(A,B).  [resolve(33,a,6,c),unit_del(b,35)].
40 $F.  [resolve(39,a,8,a)].
============================== end of proof ==========================
============================== STATISTICS ============================
Given=21. Generated=83. Kept=39. proofs=1.
Usable=11. Sos=6. Demods=0. Limbo=0, Disabled=27. Hints=0.
Megabytes=0.04.
User_CPU=0.01, System_CPU=0.00, Wall_clock=0.
============================== end of statistics =====================
============================== end of search =========================
THEOREM PROVED
Exiting with 1 proof.
Process 6643 exit (max_proofs) Thu Jun 14 20:13:23 2012
Prover9 interrupted

%------------------------------------------------------------------------------
